<?xml version="1.0" encoding="UTF-8"?>
<instance
  xmlns:xsi="http://www.w3.org/2001/XMLSchema-instance"
  xsi:noNamespaceSchemaLocation="http://www.chibios.org/xml/schema/unittest.xsd">
  <description>
    <brief>
      <value>Example Test Suite.</value>
    </brief>
    <copyright>
      <value><![CDATA[/*
    ChibiOS - Copyright (C) 2006-2026 Giovanni Di Sirio.

    Licensed under the Apache License, Version 2.0 (the "License");
    you may not use this file except in compliance with the License.
    You may obtain a copy of the License at

        http://www.apache.org/licenses/LICENSE-2.0

    Unless required by applicable law or agreed to in writing, software
    distributed under the License is distributed on an "AS IS" BASIS,
    WITHOUT WARRANTIES OR CONDITIONS OF ANY KIND, either express or implied.
    See the License for the specific language governing permissions and
    limitations under the License.
*/]]></value>
    </copyright>
    <introduction>
      <value>Test suite for EXAMPLE. The purpose of this suite is to
        perform unit tests on the EXAMPLE modules.</value>
    </introduction>
  </description>
  <global_data_and_code>
    <code_prefix>
      <value>example_</value>
    </code_prefix>
    <global_definitions>
      <value><![CDATA[
#define EXAMPLE_GLOBAL_DEFINITIONS_HERE 1
]]></value>
    </global_definitions>
    <global_code>
      <value><![CDATA[
#define EXAMPLE_GLOBAL_CODE_HERE 1
]]></value>
    </global_code>
  </global_data_and_code>
  <sequences>
    <sequence>
      <type>
        <value>Internal Tests</value>
      </type>
      <brief>
        <value>This is a sequence.</value>
      </brief>
      <description>
        <value>A sequence is a collection of test cases executed in sequence
sharing static code and data.</value>
      </description>
      <condition>
        <value />
      </condition>
      <shared_code>
        <value><![CDATA[
#include "example.h"
]]></value>
      </shared_code>
      <cases>
        <case>
          <brief>
            <value>This is a test case.</value>
          </brief>
          <description>
            <value>A test case is a small program testing a specific feature
of the system under test. Test cases should not depend on things done in
previous test cases because those could have failed leaving an unexpected
state.</value>
          </description>
          <condition>
            <value />
          </condition>
          <various_code>
            <setup_code>
              <value><![CDATA[
/* Put here code that prepares for the test case execution, this code is
   executed before the test case.*/
]]></value>
            </setup_code>
            <teardown_code>
              <value><![CDATA[
/* Put here code undoes what the test cases did, as a good practice this code
   should be able to undo things regardles of how the test case succeeded or
   failed.*/
]]></value>
            </teardown_code>
            <local_variables>
              <value><![CDATA[
/* Declare here automatic variables used in the test case, it is good practice
   to not initialize values here.*/
]]></value>
            </local_variables>
          </various_code>
          <steps>
            <step>
              <description>
                <value>This is a test case step. A step is an elementary
piece of code part of a test case.</value>
              </description>
              <tags>
                <value />
              </tags>
              <code>
                <value><![CDATA[
/* Put here the step code.*/
]]></value>
              </code>
            </step>
          </steps>
        </case>
      </cases>
    </sequence>
  </sequences>
</instance>
